{
  "schema_version": "1.0.0",
  "request_id": "toolreq_01HZZ0PLANEDITSREQ0000001",
  "tool_name": "plan_edits",
  "requested_at": "2026-04-17T00:00:00Z",
  "asset_id": "asset_01HZZ0FIRSTSLICEASSET00000001",
  "version_id": "ver_01HZZ0FIRSTSLICEBASE00000001",
  "caller": "integration-test",
  "arguments": {
    "audio_version": {
      "schema_version": "1.0.0",
      "version_id": "ver_01HZZ0FIRSTSLICEBASE00000001",
      "asset_id": "asset_01HZZ0FIRSTSLICEASSET00000001",
      "lineage": {
        "created_at": "2026-04-14T20:20:02Z",
        "created_by": "modules/io",
        "reason": "initial import"
      },
      "audio": {
        "storage_ref": "storage/audio/ver_01HZZ0FIRSTSLICEBASE00000001.wav",
        "sample_rate_hz": 44100,
        "channels": 2,
        "duration_seconds": 4,
        "frame_count": 176400,
        "channel_layout": "stereo"
      },
      "state": {
        "is_original": true,
        "is_preview": false
      }
    },
    "analysis_report": {
      "schema_version": "1.0.0",
      "report_id": "analysis_01HZZ0FIRSTSLICEBASE000001",
      "asset_id": "asset_01HZZ0FIRSTSLICEASSET00000001",
      "version_id": "ver_01HZZ0FIRSTSLICEBASE00000001",
      "generated_at": "2026-04-14T20:20:04Z",
      "analyzer": {
        "name": "default-analysis",
        "version": "0.1.1"
      },
      "summary": {
        "plain_text": "Bright stereo loop with a persistent upper-mid ridge and intact transient punch.",
        "confidence": 0.86
      },
      "measurements": {
        "levels": {
          "integrated_lufs": -15.2,
          "true_peak_dbtp": -1.5
        },
        "dynamics": {
          "crest_factor_db": 10.4,
          "transient_density_per_second": 2
        },
        "spectral_balance": {
          "low_band_db": -16.2,
          "mid_band_db": -11.5,
          "high_band_db": -9.4,
          "spectral_centroid_hz": 2720
        },
        "stereo": {
          "width": 0.61,
          "correlation": 0.38
        },
        "artifacts": {
          "clipping_detected": false,
          "noise_floor_dbfs": -74,
          "clipped_sample_count": 0,
          "hum_detected": false,
          "hum_harmonic_count": 0,
          "click_detected": false,
          "click_count": 0,
          "click_rate_per_second": 0
        }
      }
    },
    "semantic_profile": {
      "schema_version": "1.0.0",
      "profile_id": "semantic_01HZZ0FIRSTSLICEBASE001",
      "analysis_report_id": "analysis_01HZZ0FIRSTSLICEBASE000001",
      "asset_id": "asset_01HZZ0FIRSTSLICEASSET00000001",
      "version_id": "ver_01HZZ0FIRSTSLICEBASE00000001",
      "generated_at": "2026-04-14T20:20:05Z",
      "descriptors": [
        {
          "label": "slightly_harsh",
          "confidence": 0.76,
          "evidence_refs": ["analysis_01HZZ0FIRSTSLICEBASE000001:annotations[0]"],
          "rationale": "Upper-mid buildup is present across the full loop."
        }
      ],
      "summary": {
        "plain_text": "Bright stereo loop with mild harshness and intact punch."
      },
      "unresolved_terms": []
    },
    "user_request": "Clean this loop up a bit, widen it slightly, and control the peaks without crushing it.",
    "constraints": ["avoid obvious denoise artifacts", "avoid audible pumping"]
  }
}
